name,effect,example,modifier_type,usage
convoy_escort_efficiency,Modifies the efficiency of convoy escorting,convoy_escort_efficiency = 0.25,,
naval_retreat_chance,Modifies the chance of a successful naval retreat,naval_retreat_chance = 0.2,,
naval_retreat_speed,Modifies the speed of naval retreats,naval_retreat_speed = 0.25,,
ships_at_battle_start,Modifies the number of ships in the first contact,ships_at_battle_start = 0.25,,
spotting_chance,Modifies the chance to spot enemy ships,spotting_chance = 0.1,,
navy_anti_air_attack_factor,Modifies the anti air attack of naval units,navy_anti_air_attack_factor = 0.1,,
sortie_efficiency,Modifies sortie efficiency of carriers,sortie_efficiency = 0.1,,
naval_hit_chance,Modifies the overall naval hit chance,naval_hit_chance = 0.05,,
naval_coordination,Modifies the overall naval coordination,naval_coordination = 0.01,,
convoy_raiding_efficiency_factor,Modifies the efficience of commerce raiding,convoy_raiding_efficiency_factor = 0.1,,
naval_speed_factor,Modifies the speed of naval units,naval_speed_factor = 0.1,,
navy_submarine_detection_factor,Modifies the chance of detecting enemy submarines,navy_submarine_detection_factor = 0.1,,
navy_max_range_factor,Modifies the maximum range of navies,navy_max_range_factor = 0.05,,
experience_gain_navy,Bonus to daily navy experience gain (flat number),experience_gain_navy = 0.05,,
experience_gain_navy_factor,Modifies the amount of navy experience gained (percentage),experience_gain_navy_factor = 0.1,,
navy_carrier_air_attack_factor,Modifies the attack of planes of carriers,navy_carrier_air_attack_factor = 0.03,,
navy_carrier_air_targetting_factor,Modifies the defence of planes of carriers,navy_carrier_air_targetting_factor 0.03,,
navy_carrier_air_agility_factor,Modifies the agility of planes of carriers,navy_carrier_air_agility_factor = 0.04,,
navy_capital_ship_attack_factor,Modifies the attack of capital ships,navy_capital_ship_attack_factor = 0.05,,
navy_capital_ship_defence_factor,Modifies the defence of capital ships,navy_capital_ship_defence_factor = 0.05,,
navy_submarine_attack_factor,Modifies the attack of all submarine units in the navy,navy_submarine_attack_factor = 0.2,,
navy_submarine_defence_factor,Modifies the defence of all submarine units in the navy,navy_submarine_defence_factor = 0.2,,
navy_screen_attack_factor,Modifies the attack of screen ships,navy_screen_attack_factor = 0.05,,
navy_screen_defence_factor,Modifies the defence of screen ships,navy_screen_defence_factor = 0.05,,
naval_torpedo_range_factor,Modifies the range of torpedoes,naval_torpedo_range_factor = 1,,
production_factory_max_efficiency_factor,Bonus to max factory efficiency,production_factory_max_efficiency_factor = 0.1,,
line_change_production_efficiency_factor,Bonus to production efficiency retention,line_change_production_efficiency_factor = 0.2,,
production_speed_buildings_factor,Bonus to speed of overall construction,production_speed_buildings_factor = 0.1,,
conversion_cost_civ_to_mil_factor,Modifies the cost of converting civilian factories to military,conversion_cost_civ_to_mil_factor = -0.2,,
industrial_capacity_factory,Overall production boost for military factories,industrial_capacity_factory = 0.1,,
industrial_capacity_dockyard,Overall production boost for dockyards,industrial_capacity_dockyard = 0.2,,
consumer_goods_factor,Modifies the factor of factories occupied with producing consumer goods,consumer_goods_factor = 0.05,,
production_factory_efficiency_gain_factor,Modifies the production efficiency gain factor,production_factory_efficiency_gain_factor = 0.05,,
production_factory_start_efficiency_factor,Modifies the starting production efficiency of factories,production_factory_start_efficiency_factor = 0.05,,
local_building_slots_factor,Modifies the amount of factories that can be built in a state,local_building_slots_factor = - 0.5,,
local_resources_factor,Modifies the resource gain efficiency,local_resources_factor = 0.10,,
production_oil_factor,Changes oil production by the specified percentage. Stacks and adds up with local_resources_factor. There are no factors such as this available for the other resources.,production_oil_factor = 0.1,,
equipment_conversion_speed,Modifies the speed of converting equipment,equipment_conversion_speed = 0.05,,
min_export,Modifies the?% of goods that need to be exported,min_export = -0.05,,
global_building_slots_factor,Modifies the amount of factories that can be built in a state,global_building_slots_factor = 0.10,,
industry_air_damage_factor,Modifies the vulnerability of factories to bombs,industry_air_damage_factor = -0.1,,
industry_free_repair_factor,Changes free repair speed by the specified percentage,industry_free_repair_factor = 1,,
industry_repair_factor,Changes repair speed by the specified percentage,industry_repair_factor = 0.5,,
production_speed_[BUILDING NAME]_factor,"Bonus to speed of constructing specified building, for example in Old World Blues:",production_speed_water_generator_factor = 0.1,,
production_speed_arms_factory_factor,Bonus to speed of constructing military factories,production_speed_arms_factory_factor = 0.1,,
production_speed_industrial_complex_factor,Bonus to speed of constructing civilian factories,production_speed_industrial_complex_factor = 0.1,,
production_speed_bunker_factor,Bonus to speed of constructing land forts,production_speed_bunker_factor = 0.3,,
production_speed_coastal_bunker_factor,Bonus to speed of constructing coastal forts,production_speed_coastal_bunker_factor = 0.3,,
production_speed_anti_air_building_factor,Bonus to speed of constructing anti air guns,production_speed_anti_air_building_factor = 0.3,,
production_speed_dockyard_factor,Bonus to speed of constructing dockyards,production_speed_dockyard_factor = 0.2,,
production_speed_naval_base_factor,Bonus to speed of constructing naval bases,production_speed_naval_base_factor = 0.2,,
production_speed_air_base_factor,Bonus to speed of constructing air bases,production_speed_air_base_factor = 0.15,,
production_speed_rocket_site_factor,Bonus to speed of constructing rocket sites,production_speed_rocket_site_factor = 0.15,,
production_speed_radar_station_factor,Bonus to speed of constructing radar stations,production_speed_radar_station_factor = 0.15,,
production_speed_infrastructure_factor,Bonus to speed of constructing infrastructure,production_speed_infrastructure_factor = 0.2,,
production_speed_nuclear_reactor_factor,Bonus to speed of constructing nuclear reactors,production_speed_nuclear_reactor_factor = 0.25,,
production_speed_synthetic_refinery_factor,Bonus to speed of constructing synthetic refineries,production_speed_synthetic_refinery_factor = 0.1,,
research_speed_factor,"Overall research speed bonus. Ex. 0.1 means 10% reduced research time with -0.1 being 10% increased research time. Thus the more positive a number is, the better.",research_speed_factor = 0.05,,
Research time reductions,"When researching specific technologies or technology categories, add_tech_bonus is used along with the category you want to have a?% reduced research time in.","add_tech_bonus = { 	name = GER_industrial_research 	bonus = 1 	uses = 1 	category = industry }",,
MONTHLY_POPULATION,Changes monthly population growth by the specified percentage,MONTHLY_POPULATION = 0.5,,
nuclear_production_factor,Changes nuke production by the specified percentage,nuclear_production_factor = 0.1,,
